{
  "id": "example-doc-1",
  "url": "https://example.org/example-bill.pdf",
  "fetched_at": "2026-01-01T09:30:00Z",
  "sha256": "0000000000000000000000000000000000000000000000000000000000000001",
  "mime": "application/pdf",
  "storage_uri": "s3://example-bucket/0000000000000000000000000000000000000000000000000000000000000001"
}
